Name,Rating,Total Reviews,Address,Website,Phone
Tisza Cool Klíma Kft.,,,"Szeged Sárosi utca 2.10 em/60 ajtó, 6724",tiszacoolklima.hu,06 70 234 9932
Körös Klíma (Körös-Airconditional Kft.),"4,5",,"Békéscsaba, Mikszáth u. 49, 5600",korosklima.hu,06 30 349 1702
"RUCK-KLIMA, Gold Irodaszer Kft.","5,0",,"Medgyesegyháza, MagyarországPapír Irószer bolt, Dózsa György u. 10, 5666",,(06 68) 440 440
BARANYI Hűtéstechnika és Klímatechnikai Készülékgyártó és Szerviz Kft.,"4,9",,"Hódmezővásárhely, Mester u. 1f, 6800",baranyihutestechnika.hu,06 30 228 8006
CsT-Klíma Kft.,"4,9",,"Békéscsaba, Gajdács u. 14, 5600",cstklima.hu,06 20 937 6511
"Sinus Klíma - és Hűtéstechnika, Orosz Csaba","5,0",,"Szentes, Szalai u. 5, 6600",klimaeshoszivattyu.hu,06 70 533 3455
Klíma Konstrukt-Gree Klíma Értékesítés,"5,0",,"Szeged, Bérkert u. 74.3, 6726",klimakonstrukt.hu,06 70 227 7234
"SEBIKLÍMA Hűtéstechnikai Kft. - Klíma értékesítés, szerelés: Békés , Csongrád , Hajdú-Bihar, Jász-Nagykun-Szolnok megyékben","4,9",,"Tarhos, Petőfi Sándor u. 64, 5641",sebi-klima.hu,06 70 222 1046
Alfa-Klíma Kft.,"4,6",,"Szeged, Kossuth Lajos sgrt. 72/E, 6724",alfa-klima.hu,(06 62) 950 335
Frigo Trade Team Klíma Kft,"3,5",,"Szeged, Gádor köz 4, 6710",frigotrade.hu,06 20 999 3336
Csendes Klíma Kft.,"4,9",,,csendesklima.hu,06 30 318 1516
teleklima.hu ( GREE márkaképviselet ),"5,0",,"Szeged, Bálint Sándor u. 18/b, 6724",teleklima.hu,06 70 977 7888
Monaco Klíma Kft.,"4,9",,"Szeged, Algyői út 53/A, 6727",monaco-klima.hu,06 20 937 3090
Tisza Klíma - Szeged,"4,3",,"Szeged, Hont Ferenc u. 5, 6723",tiszaklima.hu,06 30 262 8669
BELUK Klímatechnika,,,"Békéscsaba, Báthori u. 23/1, 5600",beluk.hu,06 70 946 7216
Dél-Alföldi Klíma Kft - Szeged - Bemutatóterem,"4,9",,"Szeged, Kossuth Lajos sgrt. 45. fsz. 1, 6724",delklima.hu,06 70 434 3879
"DRZ Klíma Kft. - Klíma Beszerelés és Inverteres Klíma, Hűtő Fűtő Klíma, Split Klíma, Szeged, Szeged Klíma","4,8",,"Szeged, Fonógyári út 8, 6728",drzklima.com,06 30 504 4886
Körös Klíma Kft.,"5,0",,"Békéscsaba, Bartók Béla út 18, 5600",korosklima.hu,06 70 886 7080
Pingvin Klíma Bosch Nagykereskedés,"5,0",,"Kecskemét, Bethlen krt. 35, 6000",pingvinklima.hu,06 30 978 8843
Klímaszerelés,,,"Szeged, Űrhajós u., 6723",,06 70 383 2180
"Sinus Klíma - és Hűtéstechnika, Orosz Csaba","5,0",,"Szentes, Szalai u. 5, 6600",klimaeshoszivattyu.hu,06 70 533 3455
"RUCK-KLIMA, Gold Irodaszer Kft.","5,0",,"Medgyesegyháza, MagyarországPapír Irószer bolt, Dózsa György u. 10, 5666",,(06 68) 440 440
H&H Klímatechnika kis- és nagykereskedés,"4,5",,"Kecskemét, Budai u. 159, 6000",hhklima.hu,06 30 600 2006
Pingvin Klíma Bosch Nagykereskedés,"5,0",,"Kecskemét, Bethlen krt. 35, 6000",pingvinklima.hu,06 30 978 8843
BARANYI Hűtéstechnika és Klímatechnikai Készülékgyártó és Szerviz Kft.,"4,9",,"Hódmezővásárhely, Mester u. 1f, 6800",baranyihutestechnika.hu,06 30 228 8006
Körös Klíma Kft.,"5,0",,"Békéscsaba, Bartók Béla út 18, 5600",korosklima.hu,06 70 886 7080
BELUK Klímatechnika,,,"Békéscsaba, Báthori u. 23/1, 5600",beluk.hu,06 70 946 7216
"(Equinoxe) Beijer Ref Hungary Kft. Szegedi üzlete, Szeged Vásárhelyi Pál 13.","5,0",,"Szeged, Vásárhelyi Pál út 13, 6725",,06 30 397 3698
Quadratech Légtechnikai - Szellőzéstechnikai - Hőszivattyú - Klímakészülék Kereskedelem,"5,0",,"Szeged, Zentai u. 32, 6729",webaruhaz.quadratech.hu,06 70 340 2363
"Gree Sinclair Rcool Klímaáruház - Hűtő Fűtő Klíma és Inverteres Klíma, Sinclair Klíma, Split Klíma, Klíma Akció","5,0",,"Szolnok, Verseghy út 11, 5000",szigetklima.hu,06 20 849 5847
"Frankó Klíma Kft. - Hőszivattyú és Klíma Telepítés, Klímaszerelés, Klíma Tisztítás, Légtechnika","5,0",,"Békéscsaba, Temesvári u. 3, 5600",frankoklima.hu,06 20 804 7066
Békés Energetika Kft. békésklíma.hu,"4,9",,"Békés, Szélső u. 41, 5630",bekesklima.hu,06 70 338 7214
"Design és Klíma Bt. - Klíma és Légkondícionáló, Hőszivattyú, Klíma Tisztítás, Javítás, Hűtő Fűtő Klíma","4,6",,"Kecskemét, Cimbalmos u. 22, 6000",designesklima.hu,06 70 774 7954
Csendes Klíma Kft.,"4,9",,,csendesklima.hu,06 30 318 1516
VENTO 2000 Klíma- és Légtechnikai Kft.,"4,9",,"6753 Szeged, Berettyó u.-Tápé Ipari Park, 6753",vento2000.hu,(06 62) 333 992
DeCool Klímatechnika Kft.,"5,0",,"Kecskemét, Csányi János krt. 12, 6000",,06 30 531 3302
Bács Klíma Kft.,"4,5",,"Kecskemét, Tatár sor 4, 6000",bacsklima.hu,(06 76) 322 445
Cryo-klíma (Krio-klíma),"5,0",,"Békéscsaba, Lencsési út 58, 5600",cryo-klima.hu,06 70 945 2234
Klíma Csabaklíma Kft.,"4,2",,"Békéscsaba, Zöldfa u. 14, 5600",,06 70 314 0223
Tóth-Heim Kft.,"5,0",,"Szolnok, Zöldfa u. 47, 5000",tothhutestechnika.hu,06 30 976 1556
Klímabetyár -eKM-Car Kft,"5,0",,"Békéscsaba, Temesvári u. 19, 5600",,06 30 412 7922
"Hellocom Kft. klíma, napelem, műszaki szaküzlet, légtechnika, hűtéstechnika.","4,9",,"Szeghalom, Nádasdy u. 13, 5520",hellocom.hu,06 20 372 0340
Fegyver Zoltán.Ev Klíma szerelés,"4,5",,"Füzesgyarmat, Áchim.A.u.18, 5525",klima-telepites.hupont.hu,06 30 391 7037
KeveCom Kft.,"4,8",,"Nagykőrös, Kecskeméti út 7, 2750",keveklima.hu,(06 53) 352 926
Vrec-Co Kft.,"4,7",,"Szatymaz, Kossuth Lajos u. 12, 6763",vrec-co.hu,(06 62) 283 481
Frigotherm Kft.,"4,1",,"Szolnok, Vércse u. 21, 5000",klimaszolnok.hu,06 70 703 2170
MrMűszaki kereskedés Klíma áruház 06/56-341-133,"4,5",,"Szolnok, Ady Endre út 20, 5000",facebook.com,
"Vas-műszaki,Háztartási,és gazdabolt Csanádpalota .Vetró József","5,0",,"Csanádpalota, Kelemen László tér 6, 6913",kosarfono.hu,(06 62) 263 118
Szabó J & G Kft,"4,9",,"Szeged, Szabadkai út 75, 6729",szabohutogep.hu,06 30 912 9050
kamera klíma garázskapu szerelés,,,"Törökszentmiklós, Almásy út 32, 5200",bohacs.hu,(06 56) 590 575
Klímaszerelőnk - Klíma és hőszivattyú szerelés,,,"Budapest, Nagyenyed u. 11, 1132",klimaszerelonk.hu,06 30 623 8903
Skorpioklíma (Skorpió King Kft.),"4,9",,"Budapest, Összekötő u. 4, 1173",skorpioklima.hu,06 70 779 0190
Bogyisz Kft.- Klíma | Ventilátor |Központi porszívó | Kis- és Nagykereskedés,,,"Budapest, Timót u. 4a, 1097",bogyisz.hu,06 70 560 0901
Szuper Elszo '57 Kft.,"3,2",,"Szeged, Tábor u. 3, 6722",elszo.hu,(06 62) 426 448
HELLOKLIMA.COM,"4,3",,"Budapest, Fehér út 10, 1106",helloklima.com,06 70 233 3760
"YetiShop Kft. klímatechnikai nagykereskedés, kivitelezés.","4,6",,"Pécs, Megyeri út 59, 7623",yetishop.hu,(06 72) 211 311
Kistarcsaklíma,"4,7",,"Kistarcsa, Szabadság út 30, 2143",kistarcsaklima.hu,06 70 603 7830
"Tóth Klíma - klíma telepítés,klíma szerelő,központi fűtés, klíma értékesítés","4,0",,"Abádszalók, Széchenyi István út 5, 5241",,06 30 303 9574
Klímatechnika.hu - Daikin klíma bemutatóterem,"4,8",,"Budapest, Illatos út 11/b, 1097",webshop.klimatechnika.hu,06 20 934 1004
Bogyisz Kft.- Klíma kis- és nagykereskedés,"4,4",,"Budapest, Timót u. 4a, 1097",bogyisz.hu,06 70 560 0901
DT Klíma és Villanyszerelés,"5,0",,"Budapest, Fiume u. 58-Fszt. 7, 1202",dtklima.hu,06 30 389 9042
