Name,Rating,Total Reviews,Address,Website,Phone
Szerelvény Szaküzlet Pn Klíma Kft,"4,7",,"Baja, Tél u. 100, 6500",facebook.com,06 30 159 0023
KLÍMAPONT - Minker Kft.,"4,0",,"Baja, Szegedi út 113, 6500",klimapont.hu,(06 79) 420 300
"Haász Balázs Pál E.v. - Klíma szerelés Baja , Klíma karbantartás Baja","5,0",,"Baja, Béla király u. 4, 6500",facebook.com,06 70 329 1213
COOL-TESZO Kft.,"4,2",,"Baja, Neumann János utca 2, 6500",coolteszo.hu,(06 79) 323 198
Juhász Hűtés és Klímatechnika,"3,7",,"Baja, Bercsényi Miklós u. 18, 6500",,06 30 635 2828
Gienger Hungária Épületgépészeti Kft.,"4,9",,"Baja, Keleti krt. 2, 6500",gienger.hu,06 30 866 4787
"Point S Gumiszerviz - Radial Trade Kft. - gumijavítás, gumieladás, autóklíma","4,6",,"Baja, Dózsa György út 64, 6500",radialtrade.hu,(06 79) 326 495
Kohl Trade Kft.,"4,8",,"Baja, Dózsa György út 157, 6500",,06 30 608 2503
