Name,Rating,Total Reviews,Address,Website,Phone
Ódor Klíma 2000 Kft,"5,0",,"Hévíz, Ady Endre u. 20, 8380",odorklima.hu,06 70 418 7035
Klíma - hőszivattyú :: klimadirekt.hu,"4,7",,"Hévízgyörk, Orgona utca 57, 2192",klimadirekt.hu,06 30 442 8112
"Ódor autóklíma, autóvillamosság Hévíz","5,0",,"Hévíz, Ady Endre u. 20, 8380",autoklimaheviz.hu,06 70 616 2022
Windex Klíma Kft.,"4,8",,"Alsópáhok, Kölcsey Ferenc u. 23, 8394",windexklima.hu,06 70 211 0234
Klímaszerelés,,,"Keszthely, Gagarin u., 8360",klimaduo.hu,06 20 374 3263
