Name,Rating,Total Reviews,Address,Website,Phone
Chili Klíma Kft. Daikin Márkaképviselet,"4,9",,"Sopron, Ipar krt. 30-Tesco külső üzletsor, 9400",chiliklima.hu,(06 99) 999 190
Proton Klíma Kft.,"5,0",,"Nagycenk, Selyemfonoda u. 13, 9485",,06 20 357 5805
Attec Klíma Kft,"4,9",,"Nagycenk, Kossuth Lajos u. 12, 9485",attecklima.hu,06 70 275 0272
Chili Klíma Kft. Daikin Márkaképviselet,"4,9",,"Sopron, Ipar krt. 30-Tesco külső üzletsor, 9400",chiliklima.hu,(06 99) 999 190
Miklima és vill Kft.,,,"Nagycenk, Gyár u. 89, 9485",facebook.com,06 70 609 9387
