Name,Rating,Total Reviews,Address,Website,Phone
"Takács Klíma Kft - Hőszivattyú és klímaberendezés telepítés, javitás. Fűtési rendszer kivitelezés, korszerűsítése.","5,0",,"Kóny, Petőfi Sándor u 48, 9144",takacsklimakft.hu,06 20 350 8829
SZAKI Klíma - Klímaszerelés & Karbantartás és Légkondicionálás,"5,0",,,szakiklima.hu,06 70 673 4887
Klíma Gyor - www.kibe.hu,,,"Győr, Liszt Ferenc u. 30/A, 9022",kibe.hu,06 30 994 0822
Wágenhoffer Klíma Kft,"4,5",,"Győr, Szent Imre út 134, 9028",wagenhoffer.hu,06 20 852 0053
"Silver Klíma - Klímaszerelés Győr / Split klíma, hőszivattyú, VRF/VRV","5,0",,"Győr, Bútorgyári u. 1/b, 9027",silverklima.hu,06 70 907 6606
